{
                  "id": "scope_01ARZ3NDEKTSV4RRFFQ69G5FAV",
                  "description": "CRITICAL-1 fixture: authorizes an unrelated subnet only",
                  "not_after": "2099-01-01T00:00:00.000Z",
                  "allowed_cidrs": ["10.30.0.0/24"],
                  "budget_ceiling": {
                    "maximum_packets": 1000000,
                    "maximum_runtime_seconds": 3600,
                    "maximum_packets_per_second": 1000000
                  }
                }
