{
                  "id": "scope_01ARZ3NDEKTSV4RRFFQ69G5FAV",
                  "description": "bathy-engine scheduler test fixture -- loopback allowed only via for_tests_allowing_loopback",
                  "not_after": "2099-01-01T00:00:00.000Z",
                  "allowed_cidrs": ["127.0.0.1/32"],
                  "budget_ceiling": {
                    "maximum_packets": 100000000,
                    "maximum_runtime_seconds": 100000000,
                    "maximum_packets_per_second": 100000000
                  }
                }
