{
  "id": "scope_01ARZ3NDEKTSV4RRFFQ69G5FAV",
  "description": "derived edge case: an allow set with nothing in it",
  "not_after": "2099-01-01T00:00:00.000Z",
  "allowed_cidrs": [],
  "budget_ceiling": {
    "maximum_packets": 1000,
    "maximum_runtime_seconds": 60,
    "maximum_packets_per_second": 100
  }
}
