{
      "id": "scope_01ARZ3NDEKTSV4RRFFQ69G5FAV",
      "description": "Lab subnet, August 2026 inventory",
      "not_after": "2026-09-01T00:00:00.000Z",
      "allowed_cidrs": ["10.30.0.0/24"],
      "denied_cidrs": ["10.30.0.1/32"],
      "budget_ceiling": {
        "maximum_packets": 1000000,
        "maximum_runtime_seconds": 3600,
        "maximum_packets_per_second": 20000
      }
    }
